"Status","Start Time","Stop Time","Duration in ms","Parent Suite","Suite","Sub Suite","Test Class","Test Method","Name","Description"
"passed","Thu May 30 05:04:58 GMT 2024","Thu May 30 05:05:00 GMT 2024","2200","","Contact Tests","","","","should create new contact",""
"passed","Thu May 30 05:04:47 GMT 2024","Thu May 30 05:04:48 GMT 2024","934","","Login Tests","","","","should login with valid credentials",""
"passed","Thu May 30 05:05:00 GMT 2024","Thu May 30 05:05:04 GMT 2024","4006","","Contact Tests","","","","should edit existing contact",""
"passed","Thu May 30 05:04:46 GMT 2024","Thu May 30 05:04:47 GMT 2024","685","","Login Tests","","","","should get error with invalid credentils ",""
"passed","Thu May 30 05:04:48 GMT 2024","Thu May 30 05:04:50 GMT 2024","1991","","Login Tests","","","","should register new user",""
"passed","Thu May 30 05:04:50 GMT 2024","Thu May 30 05:04:52 GMT 2024","1691","","Login Tests","","","","should get error for registering new user with existing email",""
"passed","Thu May 30 05:05:04 GMT 2024","Thu May 30 05:05:05 GMT 2024","268","","Contact Tests","","","","should delete existing contact",""
