"Status","Start Time","Stop Time","Duration in ms","Parent Suite","Suite","Sub Suite","Test Class","Test Method","Name","Description"
"passed","Thu May 30 04:33:19 GMT 2024","Thu May 30 04:33:20 GMT 2024","1006","","Login Tests","","","","should get error for registering new user with existing email",""
"passed","Thu May 30 04:33:27 GMT 2024","Thu May 30 04:33:30 GMT 2024","3032","","Contact Tests","","","","should edit existing contact",""
"passed","Thu May 30 04:33:17 GMT 2024","Thu May 30 04:33:17 GMT 2024","747","","Login Tests","","","","should login with valid credentials",""
"passed","Thu May 30 04:33:25 GMT 2024","Thu May 30 04:33:27 GMT 2024","1897","","Contact Tests","","","","should create new contact",""
"passed","Thu May 30 04:33:16 GMT 2024","Thu May 30 04:33:17 GMT 2024","737","","Login Tests","","","","should get error with invalid credentils ",""
"passed","Thu May 30 04:33:30 GMT 2024","Thu May 30 04:33:30 GMT 2024","122","","Contact Tests","","","","should delete existing contact",""
"passed","Thu May 30 04:33:17 GMT 2024","Thu May 30 04:33:19 GMT 2024","1124","","Login Tests","","","","should register new user",""
