"Status","Start Time","Stop Time","Duration in ms","Parent Suite","Suite","Sub Suite","Test Class","Test Method","Name","Description"
"passed","Thu May 30 03:05:36 GMT 2024","Thu May 30 03:05:37 GMT 2024","1701","","Login Tests","","","","should register new user",""
"passed","Thu May 30 03:05:37 GMT 2024","Thu May 30 03:05:38 GMT 2024","1096","","Login Tests","","","","should get error for registering new user with existing email",""
"passed","Thu May 30 03:05:35 GMT 2024","Thu May 30 03:05:36 GMT 2024","784","","Login Tests","","","","should login with valid credentials",""
"passed","Thu May 30 03:05:44 GMT 2024","Thu May 30 03:05:46 GMT 2024","1945","","Contact Tests","","","","should create new contact",""
"passed","Thu May 30 03:05:46 GMT 2024","Thu May 30 03:05:49 GMT 2024","3169","","Contact Tests","","","","should edit existing contact",""
"passed","Thu May 30 03:05:34 GMT 2024","Thu May 30 03:05:35 GMT 2024","665","","Login Tests","","","","should get error with invalid credentils ",""
"failed","Thu May 30 03:05:49 GMT 2024","Thu May 30 03:05:49 GMT 2024","296","","Contact Tests","","","","should delete existing contact",""
